{
  "$schema": "../../../document-schema.json",
  "unique_key": "401",
  "lang": "en",
  "title": "401 Unauthorized",
  "content": "Although the HTTP standard specifies \"unauthorized\", semantically this response means \"unauthenticated\". That is, the client must authenticate itself to get the requested response.",
  "tags": [
    "401"
  ]
}