{
  "$schema": "../../../document-schema.json",
  "unique_key": "404",
  "lang": "en",
  "title": "404 Not Found",
  "content": "The server can not find requested resource. In the browser, this means the URL is not recognized. In an API, this can also mean that the endpoint is valid but the resource itself does not exist. Servers may also send this response instead of 403 to hide the existence of a resource from an unauthorized client. This response code is probably the most famous one due to its frequent occurrence on the web.",
  "tags": [
    "404"
  ]
}