{
  "$schema": "../../../document-schema.json",
  "unique_key": "308",
  "lang": "en",
  "title": "308 Permanent Redirect",
  "content": "This means that the resource is now permanently located at another URI, specified by the Location: HTTP Response header. This has the same semantics as the 301 Moved Permanently HTTP response code, with the exception that the user agent must not change the HTTP method used: If a POST was used in the first request, a POST must be used in the second request.\nClient error res",
  "tags": [
    "308"
  ]
}