{
  "$schema": "../../../document-schema.json",
  "unique_key": "506",
  "lang": "en",
  "title": "506 Variant Also Negotiates",
  "content": "The server has an internal configuration error: the chosen variant resource is configured to engage in transparent content negotiation itself, and is therefore not a proper end point in the negotiation process.",
  "tags": [
    "506"
  ]
}