{
  "$schema": "../../../document-schema.json",
  "unique_key": "405",
  "lang": "en",
  "title": "405 Method Not Allowed",
  "content": "The request method is known by the server but has been disabled and cannot be used. For example, an API may forbid DELETE-ing a resource. The two mandatory methods, GET and HEAD, must never be disabled and should not return this error code.",
  "tags": [
    "405"
  ]
}