{
  "$schema": "../../../document-schema.json",
  "unique_key": "502",
  "lang": "en",
  "title": "502 Bad Gateway",
  "content": "This error response means that the server, while working as a gateway to get a response needed to handle the request, got an invalid response.",
  "tags": [
    "502"
  ]
}