{
  "$schema": "../../../document-schema.json",
  "unique_key": "300",
  "lang": "en",
  "title": "300 Multiple Choice",
  "content": "The request has more than one possible response. The user-agent or user should choose one of them. (There is no standardized way of choosing one of the responses, but HTML links to the possibilities are recommended so the user can pick.)",
  "tags": [
    "300"
  ]
}