{
  "$schema": "../../../document-schema.json",
  "unique_key": "507",
  "lang": "en",
  "title": "507 Insufficient Storage (WebDAV)",
  "content": "The method could not be performed on the resource because the server is unable to store the representation needed to successfully complete the request.",
  "tags": [
    "507"
  ]
}