{
  "$schema": "../../../document-schema.json",
  "unique_key": "421",
  "lang": "en",
  "title": "421 Misdirected Request",
  "content": "The request was directed at a server that is not able to produce a response. This can be sent by a server that is not configured to produce responses for the combination of scheme and authority that are included in the request URI.",
  "tags": [
    "421"
  ]
}