{
  "$schema": "../../../document-schema.json",
  "unique_key": "202",
  "lang": "en",
  "title": "202 Accepted",
  "content": "The request has been received but not yet acted upon. It is noncommittal, since there is no way in HTTP to later send an asynchronous response indicating the outcome of the request. It is intended for cases where another process or server handles the request, or for batch processing.",
  "tags": [
    "202"
  ]
}