{
  "$schema": "../../../document-schema.json",
  "unique_key": "208",
  "lang": "en",
  "title": "208 Already Reported (WebDAV)",
  "content": "Used inside a <dav:propstat> response element to avoid enumerating the internal members of multiple bindings to the same collection repeatedly.",
  "tags": [
    "208"
  ]
}