{
  "$schema": "../../../document-schema.json",
  "unique_key": "307",
  "lang": "en",
  "title": "307 Temporary Redirect",
  "content": "The server sends this response to direct the client to get the requested resource at another URI with same method that was used in the prior request. This has the same semantics as the 302 Found HTTP response code, with the exception that the user agent must not change the HTTP method used: If a POST was used in the first request, a POST must be used in the second request.",
  "tags": [
    "307"
  ]
}